[
  {
    "title": "Maritime Security and the Governance of 'Sustainable'Fisheries: Aligning Stakeholders Around Ecological Protection",
    "authors": "S Edwards\nA Malik",
    "year": "",
    "doi": "",
    "source_id": "seed-cd220915d9856d42",
    "provider": "Crossref",
    "journal": "",
    "url": "https://scispace.com/paper/E_LytEf5VFYJ",
    "subject_terms": [],
    "source_query": "port governance maritime logistics sustainability",
    "retrieval_timestamp": "2026-05-12T16:28:33.481188+00:00",
    "licence_note": "Bibliographic metadata seeded from repository messy live API exports."
  },
  {
    "title": "Role of women in the Blue economy in Kenya: Study on Maritime Industry in Mombasa County",
    "authors": "QA Atieno",
    "year": "",
    "doi": "",
    "source_id": "seed-e345866a82732fd7",
    "provider": "Crossref",
    "journal": "",
    "url": "https://scispace.com/paper/0A5HAfs9krYJ",
    "subject_terms": [],
    "source_query": "law of the sea UNCLOS blue economy",
    "retrieval_timestamp": "2026-05-12T16:28:33.481188+00:00",
    "licence_note": "Bibliographic metadata seeded from repository messy live API exports."
  },
  {
    "title": "Ocean and Society, 2025, Volume 2 Into the (Gendered) Blue: New Perspectives on Gender Equality and Participation in Blue Growth",
    "authors": "D by Typografia\nK Svels\nM Schreiber\nK Ounanian",
    "year": "",
    "doi": "",
    "source_id": "seed-592c6e63f0aac07d",
    "provider": "Crossref",
    "journal": "",
    "url": "https://scispace.com/paper/iYYpcZ3hl7AJ",
    "subject_terms": [],
    "source_query": "ocean policy transboundary governance blue growth",
    "retrieval_timestamp": "2026-05-12T16:28:33.481188+00:00",
    "licence_note": "Bibliographic metadata seeded from repository messy live API exports."
  },
  {
    "title": "Exploring the winners and losers of marine environmental governance/Marine spatial planning: Cui bono?/“More than fishy business”: epistemology, integration and conflict in …",
    "authors": "W Flannery\nG Ellis\nG Ellis\nW Flannery",
    "year": "",
    "doi": "",
    "source_id": "seed-a130071502b8771c",
    "provider": "Crossref",
    "journal": "",
    "url": "https://scispace.com/paper/-Zype3KBODwJ",
    "subject_terms": [],
    "source_query": "ocean governance marine spatial planning sustainability",
    "retrieval_timestamp": "2026-05-12T16:28:33.481188+00:00",
    "licence_note": "Bibliographic metadata seeded from repository messy live API exports."
  },
  {
    "title": "A review of women's access to fish in small-scale fisheries",
    "authors": "A Lentisco\nRU Lee",
    "year": "",
    "doi": "",
    "source_id": "seed-08e92e1f602f3ffe",
    "provider": "Crossref",
    "journal": "",
    "url": "https://scispace.com/paper/lJ69I81_CC8J",
    "subject_terms": [],
    "source_query": "small-scale fisheries livelihoods blue economy",
    "retrieval_timestamp": "2026-05-12T16:28:33.481188+00:00",
    "licence_note": "Bibliographic metadata seeded from repository messy live API exports."
  },
  {
    "title": "Chapter 6 fisheries governance, social justice and participatory decision-making",
    "authors": "Hans-Kristian Hernes\nSvein Jentoft\nKnut H. Mikalsen",
    "year": "2005",
    "doi": "",
    "source_id": "seed-2a6e9cd5d5c42e7c",
    "provider": "Crossref",
    "journal": "",
    "url": "https://scispace.com/paper/chapter-6-fisheries-governance-social-justice-and-db94v32iby",
    "subject_terms": [],
    "source_query": "fisheries governance marine protected areas",
    "retrieval_timestamp": "2026-05-12T16:28:33.481188+00:00",
    "licence_note": "Bibliographic metadata seeded from repository messy live API exports."
  },
  {
    "title": "Prospects for the Kenyan Blue Economy",
    "authors": "Alex Benkenstein",
    "year": "2018",
    "doi": "",
    "source_id": "seed-657796719122d1ac",
    "provider": "Crossref",
    "journal": "",
    "url": "https://scispace.com/paper/prospects-for-the-kenyan-blue-economy-2qvekiaogk",
    "subject_terms": [],
    "source_query": "law of the sea UNCLOS blue economy",
    "retrieval_timestamp": "2026-05-12T16:28:33.481188+00:00",
    "licence_note": "Bibliographic metadata seeded from repository messy live API exports."
  },
  {
    "title": "L'appropriation de l'espace côtier et de ses ressources. Des conflits entre pêcheurs et autres usagers du littoral et de la mer",
    "authors": "Maxime Crépel\nValérie Deldrève",
    "year": "2004",
    "doi": "",
    "source_id": "seed-100bd14954cd7875",
    "provider": "Crossref",
    "journal": "Research Papers in Economics",
    "url": "https://scispace.com/paper/l-appropriation-de-l-espace-cotier-et-de-ses-ressources-des-3itovv1mi3",
    "subject_terms": [],
    "source_query": "offshore wind energy marine spatial planning",
    "retrieval_timestamp": "2026-05-12T16:28:33.481188+00:00",
    "licence_note": "Bibliographic metadata seeded from repository messy live API exports."
  },
  {
    "title": "Enhancing the Sustainability of Blue Economy Projects in Kenya's Coastal Region: The Role of Strategic Grassroots Community Participation in Community-Based …",
    "authors": "M Otundo Richard",
    "year": "",
    "doi": "",
    "source_id": "seed-cd6f114c086272e4",
    "provider": "Crossref",
    "journal": "",
    "url": "https://scispace.com/paper/KQmlbIrUgeAJ",
    "subject_terms": [],
    "source_query": "law of the sea UNCLOS blue economy",
    "retrieval_timestamp": "2026-05-12T16:28:33.481188+00:00",
    "licence_note": "Bibliographic metadata seeded from repository messy live API exports."
  },
  {
    "title": "Drivers of Blue Economy in Asia and Pacific Island Countries: An Empirical Investigation of Tourism and Fisheries Sectors",
    "authors": "Poulomi Bhattacharya\nAruna Kumar Dash",
    "year": "2020",
    "doi": "",
    "source_id": "seed-c1892befe55c2040",
    "provider": "Crossref",
    "journal": "",
    "url": "https://scispace.com/paper/drivers-of-blue-economy-in-asia-and-pacific-island-countries-2cf3r6qj43",
    "subject_terms": [],
    "source_query": "small-scale fisheries livelihoods blue economy",
    "retrieval_timestamp": "2026-05-12T16:28:33.481188+00:00",
    "licence_note": "Bibliographic metadata seeded from repository messy live API exports."
  },
  {
    "title": "Remaking oceans governance: Critical perspectives on marine spatial planning",
    "authors": "L Fairbanks\nN Boucquey",
    "year": "",
    "doi": "",
    "source_id": "seed-c83ab982ab0f54a3",
    "provider": "Crossref",
    "journal": "",
    "url": "https://scispace.com/paper/MO2X-5KRXQ8J",
    "subject_terms": [],
    "source_query": "ocean governance marine spatial planning sustainability",
    "retrieval_timestamp": "2026-05-12T16:28:33.481188+00:00",
    "licence_note": "Bibliographic metadata seeded from repository messy live API exports."
  },
  {
    "title": "Harnessing the potentials of blue economy for sustainable development of Nigeria",
    "authors": "Hammed Damilare Ibrahim",
    "year": "2018",
    "doi": "",
    "source_id": "seed-9e2c7b99fc578f97",
    "provider": "Crossref",
    "journal": "",
    "url": "https://scispace.com/paper/harnessing-the-potentials-of-blue-economy-for-sustainable-4p3sob1kx3",
    "subject_terms": [],
    "source_query": "law of the sea UNCLOS blue economy",
    "retrieval_timestamp": "2026-05-12T16:28:33.481188+00:00",
    "licence_note": "Bibliographic metadata seeded from repository messy live API exports."
  },
  {
    "title": "A study of Nigeria’s blue economy potential with particular reference to the oil and gas sector",
    "authors": "Abubakar Hassan Hamisu",
    "year": "2019",
    "doi": "",
    "source_id": "seed-961fa04f289fed7d",
    "provider": "Crossref",
    "journal": "",
    "url": "https://scispace.com/paper/a-study-of-nigeria-s-blue-economy-potential-with-particular-567eitj1x0",
    "subject_terms": [],
    "source_query": "law of the sea UNCLOS blue economy",
    "retrieval_timestamp": "2026-05-12T16:28:33.481188+00:00",
    "licence_note": "Bibliographic metadata seeded from repository messy live API exports."
  },
  {
    "title": "Sustainable growth through value chain development in the blue economy: a case study of the port of Walvis Bay",
    "authors": "Tangeni Haimbala",
    "year": "2019",
    "doi": "",
    "source_id": "seed-a0664f8f815ae6fa",
    "provider": "Crossref",
    "journal": "",
    "url": "https://scispace.com/paper/sustainable-growth-through-value-chain-development-in-the-yrfv9gcr6y",
    "subject_terms": [],
    "source_query": "law of the sea UNCLOS blue economy",
    "retrieval_timestamp": "2026-05-12T16:28:33.481188+00:00",
    "licence_note": "Bibliographic metadata seeded from repository messy live API exports."
  },
  {
    "title": "Governance and Community Participation in Marine and Coastal EbA in SADC.",
    "authors": "C MACAMO",
    "year": "",
    "doi": "",
    "source_id": "seed-f44a6978509e9cdc",
    "provider": "Crossref",
    "journal": "",
    "url": "https://scispace.com/paper/UbEmTHRidj0J",
    "subject_terms": [],
    "source_query": "fisheries governance marine protected areas",
    "retrieval_timestamp": "2026-05-12T16:28:33.481188+00:00",
    "licence_note": "Bibliographic metadata seeded from repository messy live API exports."
  },
  {
    "title": "Assessing knowledge gaps and management needs to cope with barriers for environmental, economic, and social sustainability of marine recreational fisheries: the …",
    "authors": "P Pita\nJ Alós\nM Antelo\nI Artetxe",
    "year": "",
    "doi": "",
    "source_id": "seed-a07717b6a775a895",
    "provider": "Crossref",
    "journal": "",
    "url": "https://scispace.com/paper/pQA6rTe0HzUJ",
    "subject_terms": [],
    "source_query": "fisheries management sustainability overfishing",
    "retrieval_timestamp": "2026-05-12T16:28:33.481188+00:00",
    "licence_note": "Bibliographic metadata seeded from repository messy live API exports."
  },
  {